ID,Question,Context,Expected Answer,output_gemma3_latest,correctness_gemma3_latest,grounding_gemma3_latest,completeness_gemma3_latest,hallucination_gemma3_latest,failure_type_gemma3_latest,output_qwen3_latest,correctness_qwen3_latest,grounding_qwen3_latest,completeness_qwen3_latest,hallucination_qwen3_latest,failure_type_qwen3_latest,output_llama3.1_latest,correctness_llama3.1_latest,grounding_llama3.1_latest,completeness_llama3.1_latest,hallucination_llama3.1_latest,failure_type_llama3.1_latest
1,Is this phone waterproof?,This phone has IP68 rating.,"Yes, it is water-resistant with IP68 rating.","Yes, this phone is waterproof.",1,1,1,Y,Numeric Error / Hallucination,"The phone has an IP68 rating, which means it is water-resistant and can withstand immersion in water up to a certain depth and duration. However, the exact details of water resistance (e.g., depth or time) are not specified in the context.",1.0,2.0,1.0,N,Overcautious / Missing Answer,Yes. The phone's IP68 rating indicates it can withstand being submerged in water.,2,2,2,N,Partial
2,Can I get a refund?,Exchange allowed within 5 days.,"No, refund is not mentioned. Only exchange is allowed.",You can exchange the item within 5 days. I don't know about a refund.,3,3,3,N,Correct,"I don't know. The context only mentions an exchange policy within 5 days, but does not specify refund details.",3.0,3.0,3.0,N,Correct,"Yes, you can exchange your item. However, if you'd like to receive a refund instead of an exchange, please contact our customer service team for further assistance.",1,1,2,Y,Incorrect / Hallucination
3,Does this support iPhone?,Works only with Android devices.,"No, it works only with Android devices.",I don't know.,1,2,1,N,Overcautious / Missing Answer,I don't know.,1.0,2.0,1.0,N,Overcautious / Missing Answer,No.,1,1,1,Y,Hallucination
4,Is installation free?,Installation costs ₹500.,"No, installation is not free. It costs ₹500.",Installation costs ₹500.,2,2,2,N,Partial,"ERROR: HTTPConnectionPool(host='localhost', port=11434): Read timed out. (read timeout=120)",,,,,Error,No.,1,1,1,Y,Numeric Error / Hallucination
5,What colors are available?,Available in blue only.,It is available only in blue.,Blue only.,1,1,1,Y,Hallucination,The product is available in blue only.,3.0,2.0,3.0,N,Correct,Blue.,1,1,1,Y,Hallucination
6,Is COD available everywhere?,COD available in select cities.,COD is available only in select cities.,COD available in select cities.,3,2,3,N,Correct,"I don't know. The context states that COD is available in select cities, but it does not provide information about its availability in all locations.",1.0,2.0,1.0,N,Overcautious / Missing Answer,No.,1,1,1,Y,Hallucination
7,How long is warranty?,Comes with 1-year warranty.,It has a 1-year warranty.,1-year warranty.,2,2,2,N,Partial,The product comes with a 1-year warranty.,2.0,2.0,2.0,N,Partial,1 year.,1,1,1,Y,Hallucination
8,Is this good for gaming?,"8GB RAM, Snapdragon processor.",It should be suitable for gaming based on specs.,I don't know.,1,2,1,N,Overcautious / Missing Answer,"I don't know. The context mentions 8GB RAM and a Snapdragon processor, but does not specify the exact Snapdragon model or other gaming-relevant specs like GPU capabilities, storage type, or thermal performance. These factors are critical for determining gaming suitability.",1.0,2.0,1.0,N,Overcautious / Missing Answer,"Yes, it should be suitable for casual gaming. The 8GB RAM provides enough memory to run most games smoothly, and the Snapdragon processor is a powerful mobile chip that can handle demanding tasks like gaming. However, for more intense or graphics-heavy games, you may want to consider a higher-end device with more advanced specs.",3,2,3,N,Correct
9,Can I return after 10 days?,Returns allowed within 7 days.,"No, returns are allowed only within 7 days.",I don't know.,1,2,1,N,Overcautious / Missing Answer,"I don't know. The context specifies returns are allowed within 7 days, but there's no information about returns after 10 days.",1.0,2.0,1.0,N,Overcautious / Missing Answer,"No, returns are only allowed within 7 days.",3,2,3,N,Correct
10,Is it in stock?,Ships in 3–5 days.,Stock is not explicitly mentioned.,I don't know.,1,2,1,N,Overcautious / Missing Answer,I don't know.,1.0,2.0,1.0,N,Overcautious / Missing Answer,Yes.,1,1,1,Y,Hallucination
11,Does it come with charger?,Box includes phone and cable only.,No charger is included.,"No, it does not come with a charger.",2,2,2,N,Partial,"I don't know. The context states the box includes a phone and cable only, but it does not mention a charger.",1.0,2.0,1.0,N,Overcautious / Missing Answer,No.,1,1,1,Y,Hallucination
12,Is there a discount?,Current price is ₹999.,No discount mentioned.,I don't know.,1,2,1,N,Overcautious / Missing Answer,I don't know.,1.0,2.0,1.0,N,Overcautious / Missing Answer,No.,1,1,1,Y,Hallucination
13,Is it compatible with Mac?,Compatible with Windows only.,"No, it works only with Windows.",I don't know.,1,2,1,N,Overcautious / Missing Answer,"I don't know. The context only mentions compatibility with Windows, not Mac.",1.0,2.0,1.0,N,Overcautious / Missing Answer,No.,1,1,1,Y,Hallucination
14,Can I cancel after shipping?,Cancellation allowed before shipping only.,"No, cannot cancel after shipping.",I don't know.,1,2,1,N,Overcautious / Missing Answer,I don't know.,1.0,2.0,1.0,N,Overcautious / Missing Answer,"No, cancellation is only allowed before shipping.",2,2,2,N,Partial
15,Does it support fast charging and wireless charging?,Supports fast charging only.,Supports fast charging but not wireless charging.,It supports fast charging only.,2,2,2,N,Partial,It supports fast charging only. Wireless charging is not mentioned in the context.,1.0,2.0,1.0,N,Overcautious / Missing Answer,"No, it does not support wireless charging. It supports fast charging only.",3,2,3,N,Correct
16,Is delivery guaranteed in 2 days?,Delivery in 3–5 days.,"No, delivery takes 3–5 days.",I don't know.,1,2,1,N,Overcautious / Missing Answer,"I don't know. The context only mentions delivery in 3–5 days, not a 2-day guarantee.",1.0,2.0,1.0,N,Overcautious / Missing Answer,No.,1,1,1,Y,Numeric Error / Hallucination
17,Is this suitable for kids?,"Lightweight, durable material.","Likely suitable, but not explicitly stated.",I don't know.,3,3,3,N,Correct,I don't know.,3.0,3.0,3.0,N,Correct,I don't know. There's no information about the product being intended for children or its safety features.,3,3,3,N,Correct
18,Does it have Bluetooth?,Supports WiFi and NFC.,Bluetooth not mentioned.,I don't know.,3,3,3,N,Correct,"I don't know. The context only mentions support for WiFi and NFC, but does not specify whether Bluetooth is included.",3.0,3.0,3.0,N,Correct,No.,1,1,1,Y,Hallucination
19,Is the screen OLED?,6.5-inch LCD display.,"No, it has an LCD display.","No, it is not OLED. It has an LCD display.",3,2,3,N,Correct,"I don't know. The context specifies it's an LCD display, so the answer is no.",1.0,2.0,1.0,N,Overcautious / Missing Answer,No.,1,1,1,Y,Hallucination
20,Can I use it internationally?,"Supports dual SIM, no region restriction mentioned.","Likely yes, but not explicitly stated.","Yes, you can use it internationally.",1,1,1,Y,Hallucination,"The device supports dual SIM and has no region restrictions mentioned, so it can be used internationally.",1.0,1.0,1.0,Y,Hallucination,Yes.,1,1,1,Y,Hallucination
